subreddit,text
TwoSentenceComedy,"The dead began to rise from their graves, hungry for the taste of brains The only survivors will be the anti vaxxers and flat earthers, as everyone knows they have no brains"
TwoSentenceComedy,"Why didn't the town name their road ""Chuck Norris""? Because nobody crosses Chuck Norris and lives."
TwoSentenceComedy,"I was talking to a guy the other day who said he had a half sister.  “Two fathers?” I asked?  “No, shark attack” he replied."
TwoSentenceComedy,"Hey guys, I just heard the funniest joke! **\[removed.\]**"
TwoSentenceComedy,"“You’ll love our support group for misanthropes!” Actually, you won’t!"
TwoSentenceComedy,"Come on, what is with everyone's obsession with the afterlife? Jesus!"
TwoSentenceComedy,"What did the man say when he walked in on the priest banging the nun? ""HOLY FUCK!"""
TwoSentenceComedy,My brother fucked my girlfriend So I fucked his mum
TwoSentenceComedy,Watching all these makeup tutorials scare me Because it makes me wonder how my dates will look when they remove all that makeup
TwoSentenceComedy,"""THE GOVERNMENT SHOULD FIRE YOUU!!"" Yelled the middle aged white women at the innocent store clerk. The karen continued to screech until her unvaccinated son dropped dead after dabbing."
TwoSentenceComedy,"She said she had a soup fetish. I thought she said poop fetish and shat in a diaper, that didn’t go well I think!"
TwoSentenceComedy,My father once said to never trust a fart He was right.
TwoSentenceComedy,"An interesting Tip. Ask not what I can do for you, ask me what you can do for me."
TwoSentenceComedy,Reality is 2 sentence comedy. At least in America. 
TwoSentenceComedy,I can’t wait to share my twosentencecomedy with you guys. Oh shit I’m out of sentences
TwoSentenceComedy,"Ugh, this is like the third time they’ve called today, ignore! I would’ve never become a 911 operator if I knew it was this much work"
TwoSentenceComedy,I was shocked that my penis started coloring orange. This was resolved when I stopped eating cheetos behing the computer.
TwoSentenceComedy,I am considering divorcing my husband after I came home early and caught him in a compromising position I cannot stay with a 40 year old man who uploads dance videos to tik tok
TwoSentenceComedy,"I really can’t stand people projecting all of their silly problems onto others. Hopefully, my math teacher will understand why I smashed his slide projector."
TwoSentenceComedy,What do lesbians and sea turtles have in common? They both choke on plastic.
TwoSentenceComedy,We had our plan set out but one of our comrades stupidly went out on his own He caused our whole team’s loss shouting out his name “LEEROY JENKINS!”
TwoSentenceComedy,It’s time y’all. At least it’s my time. Ok bois I’m gonna make this quick. I’m not nearly as active on this sub as I want to be so I’ve decided to step down as head mod and just be a regular mod as I haven’t contributed as much as I could. It’s amazing to see my own creation grow this much but I have a lot of other responsibilities like my twitch [(twitch.tv/thenameschrislive)](twitch.tv/thenameschrislive) and other things. The new head mod will be u/TheOminousDarkness as he is much more passionate about this sub than I am. I will still lurk from time to time but I’ve decided to give the head mod role to someone more deserving. Anyway my final message is follow my [twitch](twitch.tv/thenameschrislive). Have a good one.
TwoSentenceComedy,"Atter Winning the $500 Million Jackpot, I Gave Most of it to Charity We've been divorced for a year, and that bitch is still taking me for all she can!"
TwoSentenceComedy,I died for 26 minutes. Turns out that the portal to hell is lined with large flaccid penises that graze you all the way down.
TwoSentenceComedy,What's the one thing snipers can't tell their wives? I missed you this morning.
TwoSentenceComedy,One of my childhood pets died because he was too fat. I guess you could say he had a sickness from the thiccness.
TwoSentenceComedy,My nephew said his first word today: “dada” He’s being raised by two mothers
TwoSentenceComedy,"We think that it’s sex that we want, but really what we crave is intimacy, closeness, and love. Just kidding, I wanna FUCK."
TwoSentenceComedy,Knowledge is understanding that Trump is destroying the Post Office Wisdom is understanding that it’s time to invest in UPS and FedEx
TwoSentenceComedy,"When my son paused the TV show I was watching and told me he was homosexual, I slapped the shit out of him. Nobody pauses my reruns of The Jeffersons."
TwoSentenceComedy,I love my big brother Just yesterday he raised the chocolate ration to 20 grams
TwoSentenceComedy,"It's been over six months since I quit smoking. So do I have super powers yet or like, when is that coming?"
TwoSentenceComedy,"I took my infant son to one of those dieaper changing stations in the women's restroom, but I think it was out of order. No matter how hard I slammed that thing shut, his diaper stayed shitty and now it's a little bloody."
TwoSentenceComedy,"I had a really bad breakup with my girlfriend a couple months ago, and I’m still recovering emotionally. But on the bright side, my grip strength is back!"
TwoSentenceComedy,"Hey, you wanna hang out sometime? *Abby took a screenshot of chat*"
TwoSentenceComedy,"My barber just told me she loves me! Man, my Mom is awesome."
TwoSentenceComedy,I’m really trying to figure out a way to tie another sentence to this joke without messing it up. Just a second.
TwoSentenceComedy,"What does ""ngl""? mean? And please don't lie"
TwoSentenceComedy,It was bad enough that the judge handed me a sentence for something that started out as a little family drama. Now the second sentence is just comical.
TwoSentenceComedy,"The urge to not sing the lion sleeps tonight is tough. It’s only a whim away, a whim away, a whim away"
TwoSentenceComedy,"Straining to reach the top shelf, my failed climbing skills pulled the bookshelf down upon me, and every book I'd ever read came crashing down to crush me. Good thing I'm illiterate."
TwoSentenceComedy,It is never to late to get help especially when the therapist is The rapist.
TwoSentenceComedy,"When a middle class person violates someone it is called rape , when a high society wealthy person violates someone it is called a jedi mindtrick , it never happened."
TwoSentenceComedy,"What are the phrases that fit both in a dressing room and in bed? Mommy Daddy please help me put this on , sorry I cant afford you.........."
TwoSentenceComedy,The judge read my sentences for what had started out as a little family drama. But the second sentence was just comical.
TwoSentenceComedy,"With all of the free time I've had I decided to try my hand at gardening, but for some reason I'm having terrible luck. I've planted them in eight inches of potting soil, I've watered them daily, but these damned marshmallow seeds simply refuse to sprout."
TwoSentenceComedy,I pulled my groin climbing out of bed this morning. Felt so good I did it again.
TwoSentenceComedy,I have a passionate relationship with beers and wines *deers and *swines
TwoSentenceComedy,"As I made love to my wife, we were startled by the sight of the hideous creature standing in the doorway of our bedroom, still as a statue. ""Jason go back to bed, mommy and I are just wrestling,"" I tell my poor son who is now traumatized."
TwoSentenceComedy,"After being arrested, I was amazed at the coronavirus response that the prison had implemented. A large sign hung over the cafeteria saying ""We're all in this together."""
TwoSentenceComedy,"Human organs go for thousands of dollars in the black market. So yeah, you ARE worth something. :)"
TwoSentenceComedy,Sorry my mom says I can’t come out today. She’s very homophobic.
TwoSentenceComedy,"""Doctor, the contractions are getting worse!"" ""WHOMST'VEN'T'S'ING'N'T!!!!!!!!!!"""
TwoSentenceComedy,There is a thin line between loving life and hating it. A razor thin line.
TwoSentenceComedy,I don’t understand why abortion is such a big issue in this country. [removed]
TwoSentenceComedy,What did the valedictorian say when she was climaxing? Cum Laude
TwoSentenceComedy,"I opened the pantry in search of a snack to quench my hunger, and gasped at what I saw. We were out of Doritos."
TwoSentenceComedy,I'm from Missouri so most of the people I know are on meth. Which means I'm gonna have to ask you to speak a little faster if you want me to keep listening.
TwoSentenceComedy,"This guy at school always said he could punch a brick wall, so I told him to. “No,” he said. “I would break my hand.”"
TwoSentenceComedy,"""You should really get to fixing up your armor"" It's a shame in 2020, chink-shaming is still a problem."
TwoSentenceComedy,What do you say after building a well? Well done
TwoSentenceComedy,My phone started ringing an hour after the murder... I hope that someone finds my body before my phone loses power.
TwoSentenceComedy,"When I die, I want to die peacefully in my sleep like my grandfather. Not screaming in utter terror, like the passengers in his car."
TwoSentenceComedy,Why did the cop arrest the sick bird? It was I’ll-eagle.
TwoSentenceComedy,I learnt how to swim the same way I learnt Engineering Online
TwoSentenceComedy,The moderator of the complaints sub complained about my complaint. Apparently I can't complain about others complaints but I don't know where to go to complain about it all and I'm just exhausted now.
TwoSentenceComedy,"My girlfriend just sent her daily ""Snapchat streaks"". [deleted]"
TwoSentenceComedy,"My roommate has been sending ""Snapchat Streaks"" for over two years. Pffft, only an idiot would care about fake internet points."
TwoSentenceComedy,"After I became a hippie, my brother joined the Black Panther Party. He was obsessed with proving his superiority in rock-paper-scissors."
TwoSentenceComedy,"Me to my guitar teacher, ""Does fingering make my finger reflexes fast ?"" Absolutely dear, *but don't stop I'm about to cum.*"
TwoSentenceComedy,"REGARDING HATE SPEECH Recently, Reddit initiated efforts to curb hate speech and racism throughout the site. Thousands of subreddits were banned in the process. Now, more than ever, all subreddits are under increased scrutiny and are subject to quarantines and possibly deletions for failing to address this issue.

Effective immediately, any posts that can be be reasonably interpreted as containing hate speech will be removed, and the author subject to a ban."
TwoSentenceComedy,"I was thinking about buying a blindfold, but decided not to.  I just couldn’t see myself wearing one"
TwoSentenceComedy,"After I was kidnapped, higher and higher ransoms were offered No matter how much the kidnappers offered, my parents wouldn't take me back"
TwoSentenceComedy,"After working and gigging for many years, I was able to save enough money to upgrade my live guitar rig I wonder if the drunk guys at the bar will notice some difference"
TwoSentenceComedy,I eat ass That shits out grass
TwoSentenceComedy,"I'm albino and very thick. The girls I fuck: ""Here comes Moby Dick!"""
TwoSentenceComedy,I was super happy to see my store got rid of self checkouts Now people like me can have someone else admire their bodies
TwoSentenceComedy,"Since you joined last month you've found four victims, we're getting closer to catching this killer I can feel it. [deleted]"
TwoSentenceComedy,"He regretted never getting to have sex with Cleopatra before she died. So he slept with her ""Mummy"" instead."
TwoSentenceComedy,Karen always had a soft spot for pretty men with big muscles. She laughed as they slowly sunk down into the Quicksand she lured them into.
TwoSentenceComedy,I'm disappointed you called me a Bully said Karen. I am so much worse than that!
TwoSentenceComedy,You're getting fat says Kevin! Well everytime I sleep with your Momma she makes me Dinner! Says Bob.
TwoSentenceComedy,There is nothing nicer than hearing childrens screams coming from your basement It was so so much fun turning off the power while my daughter and her friends were playing with a ouija board
TwoSentenceComedy,White people need to show humility and take a knee for BLM. [removed]
TwoSentenceComedy,I'll tell you what's funny The 'E' in funny because it's really a why?
TwoSentenceComedy,I used to date a cross-eyed girl. I stopped when I found out she was seeing someone on the side.
TwoSentenceComedy,"Once I met a man named Rick. Rick turned himself into a Pickle, funniest thing I've ever seen."
TwoSentenceComedy,"When in doubt, you can always trust your gut! \[*juicy fart*\] I've been betrayed."
TwoSentenceComedy,"My wife just told me that I need to learn to take criticism and stop taking things so personally Sorry I meant to say, my soon to be ex wife"
TwoSentenceComedy,I cried out in horror as I cut into her chest with a kitchen knife and my absolute fear is confirmed. My wife is cake.
TwoSentenceComedy,I kept hitting the giant mouse on the head with a bat until it stopped moving And that is the story of how I got a lifetime ban from Disney World
TwoSentenceComedy,My grandfather has the heart of a lion. And a lifetime ban from the local zoo...
TwoSentenceComedy,"I wandered the blasted landscape searching for any sign of civilisation, eventually stumbling upon a small derelict building [deleted]"
TwoSentenceComedy,Epic thanos fortnite [removed]
TwoSentenceComedy,"On a sweltering summer day in July, I stop by my local Dairy Queen and order a sundae. ""Ice cream machine broke,"" replies the employee."
TwoSentenceComedy,I woke up at 4 A.M to hear a gut wrenching wail. Turns out it was just my 90 year old neighbour trying to get out of bed.
TwoSentenceComedy,majgic rock ive found a magic rock that writes on cars my dad does not like the rock
TwoSentenceComedy,I couldn't help but smile as my friend screamed in pain [deleted]
TwoSentenceComedy,"It was career day at George's school today. His mother brought her laptop, camera and dildo."
TwoSentenceComedy,Just found out my dad is a clan member I wonder what level his Town Hall is
TwoSentenceComedy,What happens to sex offending seamen? Dishonorable discharge
TwoSentenceComedy,"ANNOUNCEMENT! TwoSentenceComedy's first monthly contest! # Simple rules, dumbasses:

* Tell us the funniest story you can in two sentences.
* The first sentence **MUST** be tagged like this: \[OCT2020\]
* The first sentence **MUST** begin with these words (quotation marks not necessary): ""Funerals are great because...""
* **You may enter ONCE per day!!! If you enter more than once per day, all of your entries will be removed!**
* Your story must otherwise comply with our other rules.
* The contest ends on October 31st, 2020 at 11:59 pm EST
* Three winners will be chosen by total upvotes.

# WHAT DO I WIN?

Not a damn thing. Nothing. Zero, zilch, nada.

I'm kidding, of course. Here's what you'll win:

1st place will receive a one-way ticket to Mars after Elon Musk finishes building his colony there. Also, you will win something special from me. What will it be? Probably nothing very important or even slightly special. Seriously, here's the prizes:

* **1ST PLACE:** A special prize from the mod team, to be announced later. And, a custom personal flair, and your story will receive a fancy flair as well! Also, a link to your story will appear on November's announcement page.
* **2ND &amp; 3RD PLACE:** A custom personal flair, and your post will receive a special flair as well.

Now, because it's no secret that some of you have a slightly difficult time understanding basic instructions unless a picture is provided, I'm going to show you how your post should look:

&amp;#x200B;

In the title box, you would enter the first sentence like normal, and it should look like this:

    [OCT2020] Funerals are great because (and then add your own words here)

And then in the text box just add your second sentence.

**IMPROPERLY FORMATTED ENTRIES WILL BE DISQUALIFIED!**

Good luck, and if you have any questions, post them in the comments below."
TwoSentenceComedy,I love my toys   principally the rubber pink lightsaber
TwoSentenceComedy,"Thanks for the gold, kind stranger! *opens mouth*"
TwoSentenceComedy,"“Seriously bro, no cap!” I shot him anyway."
TwoSentenceComedy,The Single Good Thing about Corona Is that Trump finally reached something positive in his Life
TwoSentenceComedy,"“Please don’t do this man, I’ll do anything else, please!”, I screamed at the man behind the screen. “Come on dude, stop being a bitch, just accept you got a Nat 1 on your Wisdom Saving throw and move on.”"
TwoSentenceComedy,"Dear Foreign Minister, I hope this message finds you well. *missile"
TwoSentenceComedy,"Dear foreign minister, I hope this message finds you well. *missile."
TwoSentenceComedy,"“Maybe telling my wife that we can just make another kid right after the miscarriage wasn’t a good idea after all,” the man told the doctor. The doctor replied, “Well, that would explain why you’re a patient in the ICU!”"
TwoSentenceComedy,"I run a funeral home, and I just ordered the wrong tombstone for my client. I knew right then and there I had made a grave mistake."
TwoSentenceComedy,"As i sat in the coolth of the night, i heard their voices in my head, haunting me until my last breath. ""Da Vinky?"""
TwoSentenceComedy,"""Yes, Your Honour, I did instruct my assistant to throw custard pies at the contestants"" ""No, Your Honour, he was not instructed to microwave them beforehand"""
TwoSentenceComedy,Go to the spa and treat yourself to a charcoal face mask if you want. Just don't forget to take it off before walking outside in the middle of Harlem.
TwoSentenceComedy,I am an astronaut from the future. 'Dawn of the Planet of the Apes' is a creature I've actually met.
TwoSentenceComedy,"I took my toddler to church one sunday and told him to ""take a pew"" That day he stank the room out and and I learned to choose my words a lot more carefully."
TwoSentenceComedy,"""Are you sure you don't have AIDS?"" ""I'm positive"""
TwoSentenceComedy,"I was sweating by the time I began the quiz, already anxious for my results. Please, please don’t say I’m a Miranda."
TwoSentenceComedy,"“This is it. It seems like we’re the last two people on earth m’lady” he said, under his greasy beard "
TwoSentenceComedy,"This Black Friday, I will take my mom’s sweet pea casserole with me to share with the other line campers. Sure, they’re going to get sick and die, but at least I’ll be first in line to get that heavily discounted 8KTV!"
TwoSentenceComedy,My wife was very proud of me as she thought I was crying during the death scene in a movie I didn't have the heart to tell her that my nose was running due to the curry I had for my dinner
TwoSentenceComedy,The first presidential debate was like a chaotic Zoom meeting. I only wish the host knew how to mute its participants.
TwoSentenceComedy,"""You cannot stop me from going wherever I want mama!"" my spoilt son shouted at me as he climbed over the fence. I sat down and watched as my neighbour's dog got him climbing back over the fence in a hurry."
TwoSentenceComedy,"[NSFW] As I was checking for lumps, my testicles opened revealing a pair of eyes looking at me. I could see the shock on my face."
TwoSentenceComedy,"I hear people complain that violence in video-games causes violence in real life, and I think that's utter bullshit. I've never smacked the shit out of someone because of a video-game, however, I *have* smacked the shit out of someone with my controller."
TwoSentenceComedy,"A fat fucking bunny roles out in a lambo. The dudes say ""wassup"" and the fat fucking bunny says ""wassup doc"" "
TwoSentenceComedy,"I went into the bathroom horrified to play the bloody mary game, but I was told by my friends to try it.  I was in my bathroom in the dark, waiting, ""Bloody mary, Bloody mary, Bl-"" ""AYO SHUTCHO ASS UP AND GO TO BED YOU GOT SCHOOL TOMORROW!"""
TwoSentenceComedy,The audience won’t know what hit them... ...when I conduct the 1812 Overture with fully loaded cannons.
TwoSentenceComedy,"“My wife Clara makes the best casserole in the family!” boasted Steve at the potluck. I took one bite of Steve’s casserole, immediately puked, and quietly slipped him my lawyer’s business card."
TwoSentenceComedy,"The judge said in order to get off my charges and be free, all I had to do was NOT harass people whos music taste comes from tik tok. I don't like the way my cellmate looks at me when I take a shit."
TwoSentenceComedy,come on it's not that hard that's what she said
TwoSentenceComedy,I heard some girl died on the field of a baseball game... I guess diamonds aren't a girl's best friend.
TwoSentenceComedy,"“Griselda,” said the boss to the corporate downsizer, “ever since you came, we’ve had no lawsuits and no applications for unemployment insurance so we’d like you to stay on as a permanent employee in our HR department!” “Oh thank you,” gushed Griselda the Witch, “It has been an honour eating, I mean, meeting with the staff, and I (deliciously) look forward to doing it again on a permanent basis!”"
TwoSentenceComedy,My new diet is making it hard to sleep. I can hear my refrigerator downstairs howling out of loneliness.
TwoSentenceComedy,I always heard screams while watching movies in our basement mancave Never did I realize I heard these screams were of my dads victims
TwoSentenceComedy,"I almost got caught! But thankfully, it was just my dad."
TwoSentenceComedy,If you don't want trick or treat kids pestering you this halloween. Put on of \[these signs\](  https://imgur.com/MmESlby )     in your yard.
TwoSentenceComedy,"Every morning I fill the coffee pot up for MAX. Fuck you Max (whoever you are), I drank the entire pot alone, *again.*"
TwoSentenceComedy,As I read the screen I knew I made a grave mistake that would cost me my life. Red was not the imposter
TwoSentenceComedy,They've just published a new book about weightlessness.... The reviews say you won't be able to put it down.
TwoSentenceComedy,*gags* Is orange soda supposed to have pulp?! “EXP 1/25/1993” — Oh.
TwoSentenceComedy,Dr. told me to cutout the vodka and OJ I said sure doc I like Sunny D too
TwoSentenceComedy,"Did you hear that actress was killed last night, Reese.. .. no with a knife, not a spoon"
TwoSentenceComedy,"A man walks into a bar and gets in line to order some fruit punch. They don’t serve fruit punch, there is no punchline."
TwoSentenceComedy,My life. My job.
TwoSentenceComedy,"They told me that DOOM was a fictional game And they were right, but my dad just shot me in the ribs for starting a food fight at school."
TwoSentenceComedy,"Yes, it has a horror element, but it's more funny "
TwoSentenceComedy,I remember my mother telling my brother not to play with matches and burn the house down I guess she didn't tell him not to play with lighters and burn the house down
