subreddit,text
TwoSentenceHorror,"to everyone who posts here, move to r/2sentencehorror instead! [removed]"
TwoSentenceHorror,I've been vomiting blood the last few mornings after waking up. Went to see a doctor but they didn't know what to do about it because I feel fine otherwise and it isn't my blood.
TwoSentenceHorror,"Her mouth tasted of strawberries and something else which I couldn't quite place. This was the last thought I had before her tongue slipped into my mouth, went further and then sucked my brain into her mouth."
TwoSentenceHorror,"""it must be a bacterial infection then!"" The RASH she goT was HorriblE, and antibioticS
woUldn't work as BungeREiosis DeemeD her braIn Terrifying under the mri."
TwoSentenceHorror,"Cancer patients are the worst people in the world. I personally like from 10-13 healthy kids, you can also use them in soup."
TwoSentenceHorror,"The interview went great, right till the end, When the explosion threw her against the wall and the screen turned red"
TwoSentenceHorror,"[AUGUST2020] You're not me, you don't know how hard it is to stand on a field in the bright sunlight dressed in ridiculous clothes just to chase away birds. It would be a lot easier if I could move around by day as well."
TwoSentenceHorror,My brother loves this place the room that they keep the spring suits in dosent smell quite right though
TwoSentenceHorror,No matter how much weight I lose I just can't seem to change my size. These scissors will finally help me get rid of my love handles...........
TwoSentenceHorror,"I pulled my husband on top of me and said let's make another baby. He smiled and stroked my hair, replying: ""Good because I'm tired of eating chicken."""
TwoSentenceHorror,"I tried to touch as little meat as possible, but it's no use. I guess she was only joking, when she said she swallowed the key."
TwoSentenceHorror,"I thought watching him die was supposed to be the worst part. Nobody mentioned him visiting me nightly, or the pleasure he would receive from doing so."
TwoSentenceHorror,My son texted me this morning that he was going to be hanging with his friend this afternoon. I was shocked when I walked into his room and they were actually hanging.
TwoSentenceHorror,I love the feeling of cold metal pressed on my neck That feeling changed when I heard the click of a bullet load into the chamber.
TwoSentenceHorror,I often get my pills mixed up. But I don't really care because all these old folks are gonna die soon anyway.
TwoSentenceHorror,Don't forget to wash your hands [removed]
TwoSentenceHorror,The rhythmic dripping on the roof above me is slowly lulling me to sleep. [removed]
TwoSentenceHorror,"""Don't cry, Sarah,"" said my mom as she dabbed more antiseptic on the cut, ""I'll always keep you clean."" I screamed as she dug the scalpel deeper into my belly."
TwoSentenceHorror,I love spending time with my crush [removed]
TwoSentenceHorror,It’s been so long since I made love! Which is why I was so happy when my local mortuary posted a wanted ad.
TwoSentenceHorror,"Some backstory- I've always been prone to contracting pests like ticks and fleas, and recently, I found a new infestation on me. [removed]"
TwoSentenceHorror,She was hiding in the closet And she started shaking when she realize there was no closet in that room
TwoSentenceHorror,"Dear Diary, today is the day I finally talk to Alison. She'll be so surprised to see her boyfriends face again, especially while I'm wearing it...."
TwoSentenceHorror,"While stargazing, I turned my telescope to get a closer look at the moon. Nothing struck me as wrong, until it started opening up."
TwoSentenceHorror,"[AUGUST2020] ""You're not me, you don't know what I'm capable of!"" was the last utterance I thought would escape my lips before I jumped. A gasp seared through my inflamed throat as the being unmasked themself, revealing my own face."
TwoSentenceHorror,Today I witnessed a little girl getting murdered. I definitely would have reported the crime if it didn't turn me on so hard.
TwoSentenceHorror,I had locked my bedroom door and had hide under the bed thinking I was safe Then I heard a fast Series of “oof”s and someone who seemingly teleported into my room say “first try IDIOT”
TwoSentenceHorror,I was getting my laundry from the dryer while my family were gone when I had all the sudden got stuck That was when I noticed I wasn’t the only one home at that time
TwoSentenceHorror,"When the diving instructor said I couldn’t hold my breath that long, I told him he was probably worse I proved it when there weren’t that many air bubbles after he sank to the bottom of the lake"
TwoSentenceHorror,Nobody knows how much pain I go through. [removed]
TwoSentenceHorror,I feel like somethings always behind me. But how can that be if I’m at the edge of the universe?
TwoSentenceHorror,“Evacuate! It’s not safe here!” The sailor cried frantically. I can’t believe they found me.
TwoSentenceHorror,"I was locked up in the basement, inches away from a row of sharp needles. But if I’m a ghost, I shouldn’t be able to feel anything."
TwoSentenceHorror,I heard loud booing from outside of my house- even my friends Bob and Patrick. [removed]
TwoSentenceHorror,"I blocked most of my memories out when I was a child because of my family, I still remember the blood curdling shouts and screams that made my ears bleed, but my mother always told me it was just her and dad fighting to keep me safe.  One night she came up to my room in a frantic panic, she said that dad was dead and we had to run and never look back, for what was in our living room had grown too strong."
TwoSentenceHorror,... [removed]
TwoSentenceHorror,"As an artist, the hardest part has always been to make the model stay still throughout the session That was before I learned this technique, now all I worry about is thinking up creative positions for the bodies."
TwoSentenceHorror,"I told my little boy to finish the rest of his green beans, he's so picky. At this rate, he'll never be fat enough for Thanksgiving."
TwoSentenceHorror,"Sitting alone at my table in the restaurant, I took a huge bite of my food. A voice from behind me said, “Are you enjoying your meal so far?”"
TwoSentenceHorror,As a child I always wanted to become a veterinarian when I grew up. I trained by dissecting all kinds of animals I could find.
TwoSentenceHorror,"""I'm sure they'll make it to your next party"" I said to the now sobbing little girl ""But my mommy said we only get one funeral"" she explained"
TwoSentenceHorror,I met a genie and wished that I could control time [removed]
TwoSentenceHorror,"Just because I flunk, doesn’t mean I’m dumb. [removed]"
TwoSentenceHorror,My draws gore for fun. I realized why his art was so realistic when he picked up the knife and started talking about needing inspiration.
TwoSentenceHorror,Today was the first day that my daughter no longer had her stutter. It only took cutting out her tongue to get there.
TwoSentenceHorror,"After I ate some mushrooms I felt fine, but then I started feeling reallly sick. [removed]"
TwoSentenceHorror,My mother was always a strange and needy woman. [removed]
TwoSentenceHorror,"The kids at the park were overjoyed with the water guns I brought, and started running around, shooting at each other. The fact that some corrosive acids do not eath through plastic finally came to good use."
TwoSentenceHorror,"It was recently discovered that cats really do have nine lives Unfortunately by the time I dug him up, the other eight lives had gone as well"
TwoSentenceHorror,"""Honey do you have the vegetables ready for dinner?"" My mum said, at least they won't scream like last time."
TwoSentenceHorror,"I felt my baby kick, then kick again. Then I felt it bite."
TwoSentenceHorror,"It's hard being in the morgue this long. I hope they leave soon, i want to get out between these dead bodies."
TwoSentenceHorror,"[JULY2020] “Help me, I can’t find it” he yelled, frantically searching through the fridge “You don’t seriously think he would just leave the antidote sitting around, do you?” He snarked, as he had already accepted his death the moment he found out what was in that drink"
TwoSentenceHorror,"The skin dripped off of the sacrifice, shriveling as it fell. A promise, to all those present, that the advent was imminent and unstoppable."
TwoSentenceHorror,"I just can't have you in my life anymore, it's not me it's definitely you. You smell gross, and you can't stop staring at me when I sleep and that's why I'm moving you out of the freezer, okay sweetie?"
TwoSentenceHorror,"Poured cereal into the bowl, opened the fridge. There was no milk."
TwoSentenceHorror,"As the man in the mask got closer to my hiding spot, I decided to shoot my husband one last text saying I love him. That’s when the phone in the masked man’s off hand illuminated with light and gave off a “ping” noise, giving my hiding spot away."
TwoSentenceHorror,
TwoSentenceHorror,"I screamed for my husband, who was sitting in his recliner facing the TV, as my assailant shoved my head into a wall. For the first time since I met him, I cursed my husband for being born deaf."
TwoSentenceHorror,After a demon entert in the body of a little girl he saw that he isn’t the first who possessed her. In his horror he realize that this girl is never going to let them escape.
TwoSentenceHorror,"My cousin and I found a large metal bull with a door on the side that we closed when we climbed up inside. It’s dark, really dark, the door is stuck and it’s getting really hot."
TwoSentenceHorror,"After a year of being raped by my uncle, I finally told my parents what he would do to me when we were all in bed. They sent me back to my room because I shouldn’t make up stories about the dead."
TwoSentenceHorror,"Before I first found Sophie, she had no idea what love was. But now that I've kept her for a few years, I think she's starting to learn."
TwoSentenceHorror,It was 3 A.M. when I woke hungry and hesitantly made my way to the kitchen. [removed]
TwoSentenceHorror,"He thought he’d escaped the fate that had killed his friends back on the island. But as he felt the spiders burrow through his brain and out his skull, he realized he’d only brought them back with him, dooming his town."
TwoSentenceHorror,"I've always had a really overactive imagination, and loved making uo stories. Which is why when I tried to tell my parents whst he did to me, they laughed and didn't believe me."
TwoSentenceHorror,"[July2020] ""Help me, I can't find the brake!"" Is what we heard from the speeding car, heading in our direction."
TwoSentenceHorror,"Help me, I can't find the strength to do Your will. [deleted]"
TwoSentenceHorror,"I only have a few seconds, the developer's coming back If you're reading this you're the participant of the simulation and something went wrong and I don't know why they're trying to keep you in there but if you want to save your sanity it's important that you IMMEDIATELY invoke the exit subroutine by destroying the circuit underneath the skin on your l"
TwoSentenceHorror,"[JULY2020] Help me, I can't find the strength to do Your will, o Lord. My God, fill the heart of Your humble servant with holy zeal, and purge from it any sinful mercy for those wicked little infidels."
TwoSentenceHorror,"""I'm drowning please, somebody help me!"" But because I wasn't in the ocean, nobody could see me drowning in 10 gallons of water."
TwoSentenceHorror,"A long time ago, I found a genie's lamp and made what I thought would be a wonderful wish. But now, after the Earth's destruction, I'm forever cursed to float in space, cold and suffocating, but never dying."
TwoSentenceHorror,"Out of all the possible superpowers, super strength has to be the best. As I let go of my son, his crumpled body hit the floor and I realized I was wrong."
TwoSentenceHorror,"Once when I was 14, I was shopping with my family, but I was concerned about them selling milk from ten years ago. I was also concerned that I my photo was on the side of the carton."
TwoSentenceHorror,I'm starting to forget what my friends looked like. It doesn't help that they're deteriorating heads are put on a stake.
TwoSentenceHorror,"I took my mask off for a second, breathing in the cool air [removed]"
TwoSentenceHorror,"As the police officer hit me over and over again, proceeding to slam my face into the wall, I wondered why he was allowed to beat me so brutally. I gave him a bloody smile as he screamed, ""Tell me where the children are, you fucking monster, where have you buried them!?"""
TwoSentenceHorror,"My Dad’s absolutely loves the “hello thirsty, I’m Dad,” joke. But as I lie paralysed in my bed, desperately trying to convey to him how dehydrated I am, the joke has decidedly soured."
TwoSentenceHorror,"“Those little unholy urges of yours will get stronger as you grow older, but you should always resist them, because Jehovah has his eyes on you,” the priest explained to his nine year-old son, having dreaded giving him the talk for a long time. “Dad, I already told you,” the boy insisted, “that I can’t control my stupid urges, and no matter how much I want to make Jehovah proud, I always find myself killing someone new.”"
TwoSentenceHorror,"[JULY2020] “Help me I can’t find...” gibbered the man endlessly to himself as he stalked the lonely corridors of the asylum, day after day, year after year..."
TwoSentenceHorror,"[JULY2020] “Help me, I can’t find...” Gibbered the man endlessly to himself as he shuffled along the lonely corridors of the asylum, day after day, year after year."
TwoSentenceHorror,I think there’s something wrong with my dog. Ever since i had to amputate her she’d always scream ”get the hell away from me you psycho!” 
TwoSentenceHorror,"I spent the entire car ride texting. I was so distracted by my phone, it wasn't until we arrived at his house I realized the driver was my ex who had once raped me."
TwoSentenceHorror,"I cradled my baby close to me, closing my eyes... But the screams only grew louder and closer..."
TwoSentenceHorror,"Hey Alexa, where am I in the world? [removed]"
TwoSentenceHorror,"I’m in English class, bored to death- so I pull out my phone and start playing a shooting game to pass the time. I always make sure the volume is on 0, so why can I still hear gunshots?"
TwoSentenceHorror,"[JULY 2020] “Help me, I can’t find my chem textbook’ I have a test tomorrow!!” I texted my roommate whilst I was driving to campus. When the truck slammed into the drivers side of my car, the chem test was the least of my worries."
TwoSentenceHorror,"As everyone crowded around my open grave, I could only watch and smile.. They'll never realise I switched the bodies and that they're next.."
TwoSentenceHorror,It had been weeks and everyone was ignoring me... But then I saw my death portrayed in the newspapers..
TwoSentenceHorror,"The spirit endlessly wandered the mansion's halls, blood painfully dripping from her slashed throat. This wasn't the death she imagined when she committed suicide."
TwoSentenceHorror,"As I passed the old, crazy man, he begged me not to enter the decrepit, run down building.. [removed]"
TwoSentenceHorror,My best friend laughed at me when I told him about the monster in the corner of my room. He isn’t laughing anymore now that it’s in his room.
TwoSentenceHorror,"As usual, when I got back from work, the sweet scent of home and my beautiful children hit me. Except it was a little stronger this time, maybe they started rotting."
TwoSentenceHorror,My dad asked me to take the trash out... And I really hate how he describes my two sisters - even if they did just go through the garbage disposal.
TwoSentenceHorror,"I bite my lip as I send my nudes to my contact ‘Daddy,’ expecting my boyfriend’s response. I didn’t realize my mistake until my father came into my room with a wicked smile."
TwoSentenceHorror,"When I'm in a fever dream, I usually scream as loud as I can to somehow wake up. Just when I tried to, dozens of arms cover my mouth, taking away my breath and a muffled, distorted voice resonates from deep inside the dream ""Oh, screaming won't help you this time"""
TwoSentenceHorror,"I smiled to myself as the security alarm went off. A few more times, and they’ll start assuming it’s a malfunction."
TwoSentenceHorror,"During the war, I survived a close range grenade without injury and returned home to my beautiful wife and kids. But when I opened my eyes, I was unable to move my arms or legs; the doctor simply staring at me, my family nowhere to be seen."
TwoSentenceHorror,"After chasing down the man who shot my wife just a few minutes ago, and finally cornering him off, I quickly pull out my gun, pressing the trigger as soon as I can “click”"
TwoSentenceHorror,They say you shouldn’t mess with nature. I really wish I listened
TwoSentenceHorror,"Within the escape pod she got me into a tight hug and we started to exchange a deep kiss. However, the mood quickly changed once i saw the pod undock and her face started to melt."
TwoSentenceHorror,People always tell me not to joke about commiting suicide at the end of the month. I have no clue what jokes they're talking about.
TwoSentenceHorror,"Will,you,Mary,me This foursome is gonna be great"
TwoSentenceHorror,"I finally convinced my wife to experience cliff jumping with me and took her to one of the spots best suited for beginners. As her feet left the edge, I smiled knowing it was low tide."
TwoSentenceHorror,"She's so beautiful, a cute face and a great body! I can't believe it was only 13 years ago when me and my wife brought her home from the hospital."
TwoSentenceHorror,"Finally the judge decided my sentence A life time on earth seems very scary, though."
TwoSentenceHorror,"I've been hesitant my entire life and I'm tired of it, from today I wanna decide what's best for me! That was the last sentence written on the suicide note."
TwoSentenceHorror,"I’ve been up looking at the ceiling for the last 20 hours or so, Which is odd cause coffins don’t have more than 10 hours of air."
TwoSentenceHorror,I was surprised to see my teachers face on the front page of the newspaper. Surprise turned to shock when I read the caption: Pedophile found with 5 gigabytes of porn featuring his students.
TwoSentenceHorror,"Me and my husband squeezed eachothers hand, if we were going we were going together. As the Irainain police knocked down our door, i couldnt help but think; all we did wrong was fall in love"
TwoSentenceHorror,Whats the difference between a chocking fetish and necrophillia? About three minutes.
TwoSentenceHorror,"""You finally came home with something to eat!"" I soon realised what my friend meant about coming over for dinner as she locked the door behind us."
TwoSentenceHorror,"“What do you think happens,” I asked, “if God were to commit suicide?” “For all my omniscience, I too do not know - but watch closely, because you’re about to find out.”"
TwoSentenceHorror,"I always told my wife I wanted to be buried when I died. Laying in the darkness, as the claustrophobia began to set in, I could only wish the doctors checked for my pulse a little better."
TwoSentenceHorror,"an act of mercy I looked down at her as I pulled out my knife from its sheath and thought, "" I am really doing her a kindness."" No mother should have to live knowing she would never see her child again."
TwoSentenceHorror,"""Rain rain go away, come again another day"" I mumbled absentmindedly, looking at the storm clouds... and watched with growing terror as our only hope of stopping the fire began moving away, pushed by a sudden gust of wind."
TwoSentenceHorror,The affect experience evolved to a point where everyone just asks the love calculator and it matches you perfectly with another user [removed]
TwoSentenceHorror,Saw this young child crying at work today so I tried to make him feel better and asked where his parents were. I also lost my job at the orphanage later that day...
TwoSentenceHorror,"Today, I took my dog out. [removed]"
TwoSentenceHorror,"I was horrified when I awoke to a strange word carved into the exterior of my window. Dozens of questions raced through my mind in that moment; but one thought truly pried at my sanity: the shuttle's  navigation said I was still 20,000 kilometers from the International Space Station."
TwoSentenceHorror,"""Let's open those legs, sweetie."" I said. ... As I twisted the metal lever strapped on her thighs."
TwoSentenceHorror,When asked how old she was she held up four fingers [removed]
TwoSentenceHorror,"A dark figure walked towards me as night fell, cradling in its hands an softball-sized object that gave off a red glow that brightened and waned like coals in a fire. I abruptly regretted making the joke to my grandfather yesterday evening that the scariest thing about the Jack O'lantern folktale was that Hell had a supply of turnips."
TwoSentenceHorror,"“Miss Stevens, stop your day-dreaming and pay attention, this lesson on decimals is vital!” Snapped the old woman patrolling the classroom, yardstick in hand. Jill Stevens replayed that day over and over privately in her mind from the control room on Earth where she watched asteroids collide with the new planet that housed over 7 billion Earth refugees."
TwoSentenceHorror,I was always told to never throw away food because there are people around the globe that would love to have. It's been 4 years now and I'm still giving away all my remaining body parts to these poor guys!
TwoSentenceHorror,"I had a girlfriend that cheated on me once. After that, nobody wanted to cheat on me or even date me anymore."
TwoSentenceHorror,"""I'm sorry, how can I help you?"" .. Said my mom as she opened the door, when I returned from school."
TwoSentenceHorror,"“No, no, no, take me instead!” To my surprise, the firefighters turned around and started to carry me out as I waved goodbye to the kid."
TwoSentenceHorror,"Sometimes I feel an icy shiver run up my back. As I lost my energy, I realized it was cold blade entering me over and over."
TwoSentenceHorror,"I can load an antique musket rifle with a live round in less than 30 seconds. It was challenging, but I was able to load all 400 rifles when the reenactors were asleep."
TwoSentenceHorror,The bloody footprint at the scene of the murder wasn’t what worried the police. It was the fact that it was 15 feet long.
TwoSentenceHorror,"""I propose we skip the formalities..."" the smiling man began, ""...and go straight to the casualties."" I struggled against my zip ties as he pulled a pair of bolt cutters from his black leather bag."
TwoSentenceHorror,"one for mommy, one for daddy, one for grandma, one for gandpa. 'the victim has been found lying on the floor with 4 stab wounds."
TwoSentenceHorror,"i shot the thing that was at least 5 times bigger than killing it but coming closer to it, i heard thunderous steps and i realised. mom's coming"
TwoSentenceHorror,"When they started growing antlers they thought it was yet another new symptom of the Disease. Now we know some humans, the ones that survived, were simple cocoons, and so we became their final form."
TwoSentenceHorror,"Her body tensed and quivered as she felt wave after wave surge through it. I probably should have told her about the new electric fence.

(A friend told me about this from a book at work today and I thought of this sub)"
TwoSentenceHorror,"Everyone reading this right now is going to die And you, yes YOU, will be the first."
TwoSentenceHorror,“Throw your hands in the air!” exclaimed the DJ enthusiastically. Everyone in the crowd suffered extreme pain and blood loss as their disembodied limbs shot up into the sky.
TwoSentenceHorror,"DJ finished his signature with a flourish and dated it June 1, 2016. Satan checked the drying blood on the form, laughed and said, "" It's a deal, future 3-term President Trump!"""
TwoSentenceHorror,"You ever have that dream where you are falling and suddenly wake up? I have sort of, except it's has been three days now and I'm still waiting to wake up."
TwoSentenceHorror,"Even though the water was calm and warm, they said it wasn't a good place to go swimming. Each of my senses slowly fatigued as the bacteria's enzymes liquified my brain."
TwoSentenceHorror,"As everyone should know by now, cats are liquid. I put one in the oven at 400 and it evaporated within the minute."
TwoSentenceHorror,"""Don't worry! I'm a trained professional. You're never going to die under my care!"" I shivered and bit down harder on the cloth around my mouth as he began sawing my other leg."
TwoSentenceHorror,"As the innocent man was dragged to the airlock, he begged and pleaded for his life, squirming with all he had. Hopefully, these dumb humans don’t find out they’re ejecting the wrong person any time soon."
TwoSentenceHorror,"From above, the amusement park looked desolate and unkept. As the rollercoaster raced up a hill, my seat lurched and I slipped out of the lap brace."
TwoSentenceHorror,"Over the past hundreds of years, we’ve made our air unbreathable, dried up all of our water, and stripped our planet of all of its resources, and we now have to send some microorganisms to Mars in hopes of maintaining some sort of life in our solar system. The rocket missed and ended up on Earth instead."
TwoSentenceHorror,"My father abandoned our family when I was 10 years old, leading me to spend the next 15 years submerged in drugs, alcohol, and prostitution. As I rode my client to climax, I noticed my birthday tattooed on his chest."
TwoSentenceHorror,"The message drew closer and closer, in everyday objects and people. Until it inscribed itself in my own eyeballs; ""you are the vessel of our broken god; you cannot run"""
TwoSentenceComedy,I am extremely disappointed. I saw a movie on Hulu called The Rape Of Recy Taylor and needless to say that was a waste of hand lotion.
